{
  "skill": "relationship-profile",
  "version": "0.1.0",
  "mode": "apply_profile_patch",
  "profile_store_path": "relationship-profile-store.example.json",
  "person_name": "Jordan Li",
  "profile_patch": {
    "resolution_action": "update",
    "profile_tier": "active",
    "confidence": "medium",
    "aliases_add": ["Jordan Lee"],
    "compiled_truth_additions": {
      "summary": "Prefers concrete milestones and asks for clearer ownership before committing."
    },
    "timeline_append": [
      {
        "date": "2026-04-20",
        "source_title": "Partnership follow-up note",
        "summary": "Asked for two concrete case studies and a lighter implementation path."
      }
    ],
    "evidence_append": [
      "Asked for two concrete case studies.",
      "Preferred a lighter implementation path."
    ],
    "note": "Refresh the profile after the follow-up note."
  },
  "options": {
    "include_related_people": true,
    "include_profile_health": true,
    "write_store": true,
    "save_run_artifacts": true
  }
}
