{
  "skill": "relationship-profile",
  "version": "0.1.0",
  "mode": "get_profile",
  "profile_store_path": "relationship-profile-store.example.json",
  "person_name": "Jordan Li",
  "options": {
    "include_related_people": true,
    "include_profile_health": true,
    "save_run_artifacts": true
  }
}
