{
  "skill": "relationship-profile",
  "version": "0.1.0",
  "mode": "get_profile",
  "profile_store_path": "D:/Lenny_Bcontext/skill-system/relationship-ingestion/incremental-scenarios/2026-04-13-jf-weather-agent/relationship-profile-store.incremental-2026-04-13-jf-weather-agent.json",
  "person_name": "剑锋",
  "options": {
    "include_related_people": true,
    "include_profile_health": true,
    "save_run_artifacts": true
  }
}
